{
  "analysisSchemaVersion": "s4a-taxonomy-v1",
  "shardId": "transformer-llm",
  "scope": {
    "label": "Transformer und LLM-Grundlagen",
    "weekIds": [
      "w22",
      "w23",
      "w24",
      "w25",
      "w26"
    ],
    "definitionRoots": [],
    "expectedEntryCount": 30
  },
  "entries": [
    {
      "sourceKind": "legacy-week-exercise",
      "sourceFile": "content/exercises/w22.json",
      "sourceId": "w22-e1",
      "currentDefinitionId": "w22-e1",
      "legacyWeekId": "w22",
      "competencyIds": [
        "c-dl-attention"
      ],
      "lessonIds": [
        "l-tf-attention"
      ],
      "learningObjective": "Die lernende Person ordnet die Rollen von Query, Key und Value in der Scaled Dot-Product Attention korrekt zu und widerlegt falsche Zuschreibungen (Skalierung, Maske, Anfragen) an die Value-Matrix.",
      "activityType": "single-choice",
      "graderId": "deterministic",
      "generatorId": null,
      "referenceSolverId": null,
      "currentDifficulty": 1,
      "proposedFamilyId": "transformer-llm-attention-rollen-konzept",
      "proposedCaseType": "qkv-rollen-diskriminieren",
      "proposedDifficultyProfile": "basic-recall",
      "answerContract": {
        "kind": "correct-choice-id",
        "inputShape": "ein Choice-Identifier (a-d)",
        "comparison": "exakte ID-Gleichheit gegen expectedAnswer.correctChoice",
        "tolerance": null
      },
      "solverContract": {
        "kind": "expected-answer",
        "authoritative": true,
        "contract": "expectedAnswer.correctChoice fixiert die korrekte Option; der deterministische Grader vergleicht die gewaehlte Choice-ID exakt.",
        "testEvidence": [
          "tests/w22_w26_content.test.mjs: w22 single-choice hat genau eine korrekte Option",
          "assets/js/core/graders.js: gradeChoice vergleicht die Choice-ID exakt"
        ]
      },
      "feedbackRuleCount": 3,
      "feedbackConsumerStatus": "fully-consumed",
      "semanticClassification": "unique",
      "targetAction": "migrate",
      "targetRationale": "Woche ist vollstaendig getestet (tests/w22_w26_content.test.mjs, Generator-/Solver-Tests) und im Katalog registriert; die Aufgabe bleibt fachlich einzigartig und wandert als Quelle in eine kanonische Definition. Konzeptfrage ohne Mastery-Anspruch; sie bleibt Bearbeitungsnachweis und gehoert zur Attention-Lektion.",
      "preservedDidacticContent": {
        "solutionPath": "Rollen zuordnen: Scores und Softmax-Gewichte entstehen nur aus Q und K; V geht erst nach dem Softmax in die gewichtete Summe ein.",
        "errorPatterns": [
          "Value mit Maske verwechselt",
          "Skalierung den Values zugeschrieben",
          "Query-Rolle den Values zugeschrieben"
        ],
        "representation": "Vier deutsche Textoptionen mit LaTeX-Notation zu Q/K/V",
        "transferDemand": "Falsche Rollenzuschreibungen in neuen Formulierungen erkennen und begruenden",
        "difficultyRationale": "Konzeptfrage mit drei plausiblen Distraktoren; reine Begriffszuordnung ohne Rechnung.",
        "uniqueElements": [
          "Distraktor koppelt die Sichtbarkeitsmaske an V",
          "Skalierungs-Distraktor verknuepft 1/sqrt(d_k) mit V"
        ]
      },
      "persistenceCompatibility": {
        "status": "preserve-id",
        "currentAttemptDefinitionId": "w22-e1",
        "requiredAction": "Definition-ID w22-e1 bei der Migration unverändert übernehmen; nur bei Umbenennung eine getestete Alias-Zuordnung in der Attempt-Persistenz (definitionId) ergänzen."
      },
      "uncertainty": [
        {
          "field": "lessonIds",
          "level": "low",
          "reason": "Die Lektion verlinkt keine Aufgabenzuordnung; die Zuordnung laeuft ueber Kompetenz und Curriculum-Units.",
          "resolution": "Bei kanonischen Definitionen eine explizite Exercise-Lesson-Verknuepfung im Katalog ergaenzen."
        }
      ],
      "evidence": [
        {
          "kind": "source-field",
          "file": "content/exercises/w22.json",
          "pointer": "/exercises/0",
          "note": "Quellfelder von w22-e1: type=single-choice, grader=deterministic, difficulty=1, skillIds=[\"c-dl-attention\"], deterministicSeed=2201, 3 Feedbackregeln."
        },
        {
          "kind": "lesson-match",
          "file": "content/lessons/transformer-llm/tf-attention.json",
          "pointer": "/competencyIds",
          "note": "Lektion undefined (Attention und Transformer-Grundlagen) trägt c-dl-attention und ist über curriculum.json w22-Learning-Units mit der Woche verknüpft."
        },
        {
          "kind": "runtime-contract",
          "file": "assets/js/core/legacy_exercise_adapter.mjs",
          "pointer": "/adaptLegacyExercise",
          "note": "Adapter setzt definitionId = exerciseId und übernimmt grader, generatorId (Registry-Prüfung), feedbackRules und difficulty unverändert."
        },
        {
          "kind": "runtime-contract",
          "file": "assets/js/core/graders.js",
          "pointer": "/gradeChoice",
          "note": "gradeChoice liest die choice === 'x'-Regeln und liefert die Diagnose zum gewaehlten Distraktor."
        },
        {
          "kind": "persistence-contract",
          "file": "assets/js/core/progress_store.js",
          "pointer": "/attempts/definitionId",
          "note": "Versuche speichern definitionId; heute ist das der exerciseId-String, sodass Bestands-Attempts bei ID-Erhalt weiterlaufen."
        },
        {
          "kind": "comparison",
          "file": "content/exercises/w23.json",
          "pointer": "/exercises/0",
          "note": "Gleiches Antwortformat (single-choice, Konzeptfrage ohne Mastery), aber anderer Gegenstand: Attention-Rollen statt Subword-Zerlegung."
        }
      ],
      "humanReviewRequired": false,
      "humanReviewReasons": [],
      "comparisonSourceIds": [
        "w23-e1"
      ]
    },
    {
      "sourceKind": "legacy-week-exercise",
      "sourceFile": "content/exercises/w22.json",
      "sourceId": "w22-e2",
      "currentDefinitionId": "w22-e2",
      "legacyWeekId": "w22",
      "competencyIds": [
        "c-dl-attention"
      ],
      "lessonIds": [
        "l-tf-attention"
      ],
      "learningObjective": "Die lernende Person leitet aus den Formen von Q, K und V ab, wie viele Zellen einer kausal maskierten Score-Matrix vor dem Softmax auf -inf gesetzt werden, und gibt die Anzahl als ganze Zahl an.",
      "activityType": "numeric",
      "graderId": "deterministic",
      "generatorId": "genAttentionShape",
      "referenceSolverId": null,
      "currentDifficulty": 2,
      "proposedFamilyId": "transformer-llm-attention-shapes-zaehlen",
      "proposedCaseType": "kausale-maskenzellen-zaehlen",
      "proposedDifficultyProfile": "core-application",
      "answerContract": {
        "kind": "seeded-integer",
        "inputShape": "eine ganze Zahl",
        "comparison": "exakter Integer-Vergleich gegen den generierten Erwartungswert",
        "tolerance": null
      },
      "solverContract": {
        "kind": "seed-generator",
        "authoritative": true,
        "contract": "genAttentionShape(seed) liefert den erwarteten Integer (Default-Seed 2211); ein unabhaengiger Solver stimmt auf allen getesteten Seeds ueberein.",
        "testEvidence": [
          "tests/w22_w26_generators.test.mjs: independent solver agrees on every seed",
          "tests/fixtures/generator-golden-corpus.json: Golden-Werte fuer genAttentionShape",
          "tests/char_group_d_registry.test.mjs: Generator in der Registry gefuehrt"
        ]
      },
      "feedbackRuleCount": 3,
      "feedbackConsumerStatus": "fully-consumed",
      "semanticClassification": "unique",
      "targetAction": "migrate",
      "targetRationale": "Woche ist vollstaendig getestet (tests/w22_w26_content.test.mjs, Generator-/Solver-Tests) und im Katalog registriert; die Aufgabe bleibt fachlich einzigartig und wandert als Quelle in eine kanonische Definition. Der Seed-Generator genAttentionShape ist mit 200 Seeds getestet und in der Registry verdrahtet; Migration erhaelt den Generatorvertrag.",
      "preservedDidacticContent": {
        "solutionPath": "Erst Shapes ableiten (Score-Matrix n x m), dann die kausale Maske als obere Dreiecksmatrix lesen: verdeckt sind n(n-1)/2 Zellen oberhalb der Diagonale.",
        "errorPatterns": [
          "Diagonale in die Maskenzaehlung einbezogen",
          "Zeilen- mit Spaltenzahl vertauscht",
          "Gesamtzahl der Zellen statt verdeckter Zellen angegeben"
        ],
        "representation": "Numerische Eingabe mit LaTeX-beschriebener Score-Matrix und kausaler Maske",
        "transferDemand": "Zaehlmuster auf neue n-m-Kombinationen und Maskenvarianten uebertragen (Neue-Zahlen-Instanzen)",
        "difficultyRationale": "Zweistufig: Formen ableiten, dann Kombinatorik der Dreiecksmatrix; typischer Kernfall.",
        "uniqueElements": [
          "Kausale Maske als Zaehlanlass",
          "Shape-Vertrag QK^T im Hinweistext",
          "Generator mit 200 getesteten Seeds"
        ]
      },
      "persistenceCompatibility": {
        "status": "preserve-id",
        "currentAttemptDefinitionId": "w22-e2",
        "requiredAction": "Definition-ID w22-e2 bei der Migration unverändert übernehmen; nur bei Umbenennung eine getestete Alias-Zuordnung in der Attempt-Persistenz (definitionId) ergänzen."
      },
      "uncertainty": [
        {
          "field": "proposedFamilyId",
          "level": "low",
          "reason": "Die Familie ist auf den Loesungsweg dieser Woche begrenzt; aehnliche Zahlenformate anderer Wochen teilen den Kernloesungsweg nicht.",
          "resolution": "Familiegrenze bei der S4A-Synthese gegen die anderen Shards nochmals gegenpruefen."
        },
        {
          "field": "lessonIds",
          "level": "low",
          "reason": "Die Lektion verlinkt keine Aufgabenzuordnung; die Zuordnung laeuft ueber Kompetenz und Curriculum-Units.",